{"schemaVersion":"1.0.0","date":"2026-09-26","report":{"schemaVersion":"1.0.0","id":"daily-brief-2026-09-26","type":"daily_market_brief","locale":"vi-VN","timezone":"Asia/Ho_Chi_Minh","generatedAt":"2026-09-26T08:50:00+07:00","coverage":{"from":"2026-09-25T15:00:00+07:00","to":"2026-09-26T08:50:00+07:00","session":"closed"},"marketSession":"closed","disclaimer":"Nguon cong khai CafeF, Vietstock, 24HMoney, Barron's, Bloomberg, Yahoo. Cuoi tuan 26/9 ICT, HOSE dong cua.","ui":{"pageSizeNews":8,"defaultChartTab":"vnindex","defaultWorldSymbol":"DJI"},"snapshot":{"quotes":[{"symbol":"VNINDEX","nameVi":"VN-Index","assetClass":"equity_index","price":1785.11,"changePct":0.56,"sourceId":"src-24h"},{"symbol":"HNX","nameVi":"HNX-Index","assetClass":"equity_index","price":272.21,"changePct":-0.21,"sourceId":"src-vietstock"},{"symbol":"DXY","nameVi":"DXY","assetClass":"fx","price":101.01,"changePct":-0.27,"sourceId":"src-yahoo-vn"},{"symbol":"DJI","nameVi":"Dow Jones","assetClass":"equity_index","price":51828.62,"changePct":0.93,"sourceId":"src-yahoo-vn"},{"symbol":"NDX","nameVi":"Nasdaq 100","assetClass":"equity_index","price":30608.13,"changePct":0.42,"sourceId":"src-yahoo-vn"},{"symbol":"SPX","nameVi":"S&P 500","assetClass":"equity_index","price":7743.41,"changePct":0.51,"sourceId":"src-yahoo-vn"},{"symbol":"NKY","nameVi":"Nikkei 225","assetClass":"equity_index","price":66364.2,"changePct":1.3,"sourceId":"src-yahoo-vn"},{"symbol":"HSI","nameVi":"Hang Seng","assetClass":"equity_index","price":24510.09,"changePct":-1.01,"sourceId":"src-yahoo-vn"},{"symbol":"WTI","nameVi":"WTI","assetClass":"commodity","price":92.47,"changePct":-2.26,"sourceId":"src-barrons"},{"symbol":"XAU","nameVi":"Vang COMEX","assetClass":"commodity","price":4320.5,"changePct":0.52,"sourceId":"src-barrons"},{"symbol":"BTC","nameVi":"Bitcoin","assetClass":"crypto","price":83928.0,"changePct":-0.79,"sourceId":"src-yahoo-btc"},{"symbol":"USDVND","nameVi":"USD/VND","assetClass":"fx","price":25974.0,"changePct":-0.06,"sourceId":"src-yahoo-vn"}]},"globalNews":[{"id":"g1","date":"2026-09-26T03:05:00+07:00","title":"Pho Wall tang cuoi tuan khi dau giam","summary":"S&P 500 +0,51% len 7.743,41; Nasdaq 100 +0,42%; Dow +0,93%.","impact":{"direction":"risk_on","horizon":"days","assets":["SPX","DJI","NDX"],"text":"Chung khoan My hoi; rui ro nang luong ha nhiet ngan han."},"sourceId":"src-bloomberg"},{"id":"g2","date":"2026-09-25T10:03:00+07:00","title":"Dau rut, vang giu gan 4.320 USD","summary":"WTI quanh 92,5 USD (-2,3%). Vang COMEX 4.320,5 USD (+0,52%).","impact":{"direction":"mixed","horizon":"days","assets":["WTI","XAU"],"text":"Gia dau giam ho tro lam phat; vang van nhay voi loi suat."},"sourceId":"src-bloomberg"},{"id":"g3","date":"2026-09-25T07:00:00+07:00","title":"Loi suat My lap dinh nhieu nam","summary":"10Y cao nhat tu 2007, 30Y cao nhat tu 2004.","impact":{"direction":"risk_off","horizon":"weeks","assets":["DXY","VNINDEX","SPX"],"text":"Loi suat cao can dong von ngoai vao thi truong moi noi."},"sourceId":"src-bloomberg"},{"id":"g4","date":"2026-09-26T03:31:00+07:00","title":"Thuong dinh Trump-Tap: it thoa thuan","summary":"My-Trung gia han dinh chien thuong mai them 2 thang.","impact":{"direction":"mixed","horizon":"weeks","assets":["HSI","NDX"],"text":"Giam rui ro thue ngan han; AI van la diem nghe."},"sourceId":"src-bloomberg"},{"id":"g5","date":"2026-09-25T18:37:00+07:00","title":"Chung khoan Chau Au tang tuan dau sau 4 tuan","summary":"FTSE 100 dong 10.695,25 (+0,14%).","impact":{"direction":"risk_on","horizon":"days","assets":["FTSE","SPX"],"text":"Au huong loi khi gia nang luong ha nhiet."},"sourceId":"src-bloomberg"},{"id":"g6","date":"2026-09-25T15:45:00+07:00","title":"Nikkei tang 1,3%; Hang Seng giam 1%","summary":"Nikkei 66.364,20; Hang Seng 24.510,09.","impact":{"direction":"mixed","horizon":"intraday","assets":["NKY","HSI"],"text":"A phan hoa: Nhat manh, Hong Kong yeu."},"sourceId":"src-yahoo-vn"},{"id":"g7","date":"2026-09-26T08:20:00+07:00","title":"Bitcoin lui ve gan 83.900 USD","summary":"BTC khoang 83.928 USD (-0,8%); ETH 2.689.","impact":{"direction":"neutral","horizon":"days","assets":["BTC"],"text":"Bien dong crypto han che khi lai suat thuc My con cao."},"sourceId":"src-yahoo-btc"},{"id":"g8","date":"2026-09-26T08:00:00+07:00","title":"DXY lui 101,01; hang hoa phan hoa","summary":"WTI 92,47 (-2,26%); vang 4.320,5 (+0,52%).","impact":{"direction":"mixed","horizon":"days","assets":["DXY","WTI","XAU"],"text":"USD hoi yeu giup vang; dau giam giam ap luc lam phat."},"sourceId":"src-barrons"}],"vietnamNews":[{"id":"v1","date":"2026-09-25T22:45:00+07:00","title":"VN-Index tang 10 diem phien cuoi tuan","summary":"Chot 25/9, VN-Index 1.785,11 (+0,56%). GTGD HoSE ~15.278 ty.","impact":{"direction":"mixed","horizon":"days","assets":["VNINDEX"],"text":"Hoi ky thuat sau 2 phien roi, thanh khoan con yeu."},"sourceId":"src-cafef"},{"id":"v2","date":"2026-09-25T20:50:00+07:00","title":"Ho Vin keo chi so: VHM +5,66%","summary":"VHM, VPL, VRE, VIC dan dat. HNX 272,21.","impact":{"direction":"mixed","horizon":"intraday","assets":["VNINDEX","VHM"],"text":"Da tang phu thuoc tru Vin; do rong chua xac nhan."},"sourceId":"src-vietstock"},{"id":"v3","date":"2026-09-25T22:45:00+07:00","title":"Ngoai ban rong 254 ty HoSE, gom SBT 247 ty","summary":"Mua SBT 247, BSR 108. Ban TCB 115, VIC 78.","impact":{"direction":"risk_off","horizon":"days","assets":["VNINDEX","SBT"],"text":"Ban rong ha nhiet nhung chuoi rut von chua dao."},"sourceId":"src-cafef"},{"id":"v4","date":"2026-09-25T17:41:00+07:00","title":"Lai suat qua dem LHNH ha con ~1%","summary":"ON VND xuong ~1%/nam ngay 24/9 tu 7% ngay 21/9.","impact":{"direction":"neutral","horizon":"days","assets":["VNINDEX"],"text":"Thanh khoan he thong doi dao ngan han."},"sourceId":"src-cafef"},{"id":"v5","date":"2026-09-24T15:51:00+07:00","title":"Xang E10 len 27.087 dong/lit","summary":"E5 26.397; E10 27.087; diesel 30.497.","impact":{"direction":"risk_off","horizon":"weeks","assets":["VNINDEX"],"text":"Gia xang cao cong ap luc CPI cuoi nam."},"sourceId":"src-vneconomy"},{"id":"v6","date":"2026-09-25T23:38:00+07:00","title":"PNJ ha ke hoach, kich ban lo 6.270 ty","summary":"Doanh thu 2026 ha con 39.057 ty. Co tuc 2026 ve 0%.","impact":{"direction":"risk_off","horizon":"months","assets":["PNJ"],"text":"Tin tieu cuc nganh vang trang suc."},"sourceId":"src-cafef"},{"id":"v7","date":"2026-09-25T17:51:00+07:00","title":"VCBS: BSR lai Q3 co the +446%","summary":"VHM +243%, PVT +133%, MSN +121%.","impact":{"direction":"mixed","horizon":"quarters","assets":["BSR","VHM"],"text":"KQKD phan hoa; dau khi/BDS sang hon CK."},"sourceId":"src-cafef"},{"id":"v8","date":"2026-09-25T00:36:00+07:00","title":"Nhip 24/9: hon 400 ma do","summary":"VN-Index 1.775 (-1,48%), day quanh 1.770.","impact":{"direction":"risk_off","horizon":"days","assets":["VNINDEX"],"text":"Day 24/9 quanh 1.770 can giu sang tuan sau."},"sourceId":"src-cafef"}],"vietnamMacro":[{"indicator":"CPI","nameVi":"CPI YoY T8/2026","value":4.89,"unit":"%","sourceId":"src-vneconomy"},{"indicator":"CPI","nameVi":"CPI BQ 8 thang","value":4.45,"unit":"%","sourceId":"src-vneconomy"},{"indicator":"FDI","nameVi":"FDI dang ky 8 thang","value":40.63,"unit":"ty USD","sourceId":"src-vneconomy"},{"indicator":"FDI","nameVi":"FDI thuc hien 8 thang","value":17.25,"unit":"ty USD","sourceId":"src-vneconomy"},{"indicator":"FX","nameVi":"Ty gia trung tam","value":25641,"unit":"VND","sourceId":"src-vietnambiz"},{"indicator":"RATES","nameVi":"LS qua dem LHNH","value":1.1,"unit":"%","sourceId":"src-vietnambiz"},{"indicator":"CREDIT","nameVi":"Tin dung YoY T7","value":17.7,"unit":"%","sourceId":"src-vietnambiz"},{"indicator":"FUEL","nameVi":"Xang E10 RON95","value":27087,"unit":"d/l","sourceId":"src-vneconomy"}],"equityMarket":{"index":{"priorClose":{"date":"2026-09-25","price":1785.11,"change":10.02,"changePct":0.56},"latest":{"date":"2026-09-25","price":1785.11,"change":10.02,"changePct":0.56,"session":"closed","weekChange":-30.55,"weekChangePct":-1.68}},"liquidity":{"hose":{"volumeShares":624262395,"valueVndBn":15278,"note":"25/9 GTGD HoSE ~15.278 ty."}},"foreign":{"netValueVndBn":-254,"note":"25/9 ngoai -254 ty HoSE."},"proprietary":{"netValueVndBn":null,"note":"Chua tach tu doanh."},"retail":{"netValueVndBn":null,"note":"Chua tach ca nhan."},"relatedIndices":[{"symbol":"VNINDEX","price":1785.11,"changePct":0.56},{"symbol":"VN30","price":1938.5,"changePct":0.33},{"symbol":"HNX","price":272.21,"changePct":-0.21}]},"worldMarkets":{"quotes":[{"symbol":"DXY","nameVi":"DXY","price":101.01,"changePct":-0.27},{"symbol":"DJI","nameVi":"Dow","price":51828.62,"changePct":0.93},{"symbol":"NDX","nameVi":"Nasdaq","price":30608.13,"changePct":0.42},{"symbol":"SPX","nameVi":"S&P 500","price":7743.41,"changePct":0.51},{"symbol":"RUT","nameVi":"Russell 2000","price":2828.89,"changePct":-0.24},{"symbol":"FTSE","nameVi":"FTSE 100","price":10695.25,"changePct":0.14},{"symbol":"NKY","nameVi":"Nikkei","price":66364.2,"changePct":1.3},{"symbol":"HSI","nameVi":"Hang Seng","price":24510.09,"changePct":-1.01}]},"cryptoMarkets":{"quotes":[{"symbol":"BTC","nameVi":"Bitcoin","price":83928.0,"changePct":-0.79},{"symbol":"ETH","nameVi":"Ethereum","price":2689.04,"changePct":-0.01}]},"companies":[{"ticker":"VHM","headline":"VHM +5,66%, tru keo VN-Index","impact":{"direction":"risk_on","horizon":"intraday","assets":["VHM"],"text":"Vinhomes dan dat ho Vin."},"metrics":{"changePct":5.66},"sourceId":"src-vietstock"},{"ticker":"SBT","headline":"Ngoai gom SBT khoang 247 ty","impact":{"direction":"risk_on","horizon":"days","assets":["SBT"],"text":"Diem mua rong lon nhat phien 25/9."},"metrics":{"changePct":null},"sourceId":"src-cafef"},{"ticker":"VPB","headline":"VPB +4,07% len 23.000 dong","impact":{"direction":"risk_on","horizon":"intraday","assets":["VPB"],"text":"Ngan hang von hoa lon bat nhip hoi phuc."},"metrics":{"changePct":4.07},"sourceId":"src-vietstock"},{"ticker":"PNJ","headline":"PNJ ha ke hoach, cat co tuc","impact"